{
  "all_activity_review": "已覆盖全部计划内外活动。",
  "climbing_and_combined_load": "跑步、攀岩与恢复联合判断为保持。",
  "evidence_refs": [
    "daily-observation:public-synthetic"
  ],
  "health_review": "睡眠与恢复存在波动，继续观察趋势。",
  "plan_comparison": "计划比较仅作次要背景。",
  "progression_decision": "hold",
  "schema_version": "weekly_model_decision_v1",
  "technical_findings": [],
  "training_plan": {
    "days": {
      "day_1": {
        "activity_kind": "running",
        "duration_minutes": 45,
        "feel_guidance": "按RPE与动作体感执行",
        "load_level": "hard",
        "name": "跑步课程",
        "purpose": "维持稳定训练",
        "rpe_max": 7,
        "rpe_min": 6,
        "session_type": "sos_threshold",
        "steps": {
          "cooldown": {
            "end_condition": "放松完成",
            "instruction": "完成放松",
            "name": "放松"
          },
          "main": {
            "end_condition": "主体完成",
            "instruction": "完成主体",
            "name": "主体"
          },
          "recovery": {
            "end_condition": "恢复完成",
            "instruction": "完成恢复",
            "name": "恢复"
          },
          "warmup": {
            "end_condition": "热身完成",
            "instruction": "完成热身",
            "name": "热身"
          }
        },
        "stop_conditions": [
          "疼痛、胸痛、晕眩或异常呼吸时停止"
        ],
        "technique_notes": [
          "保持动作稳定"
        ]
      },
      "day_2": {
        "activity_kind": "climbing",
        "duration_minutes": 45,
        "feel_guidance": "按RPE与动作体感执行",
        "load_level": "low",
        "name": "攀岩技术课",
        "purpose": "维持稳定训练",
        "rpe_max": 4,
        "rpe_min": 2,
        "session_type": "climbing_technique",
        "steps": {
          "cooldown": {
            "end_condition": "放松完成",
            "instruction": "完成放松",
            "name": "放松"
          },
          "main": {
            "end_condition": "主体完成",
            "instruction": "完成主体",
            "name": "主体"
          },
          "recovery": {
            "end_condition": "恢复完成",
            "instruction": "完成恢复",
            "name": "恢复"
          },
          "warmup": {
            "end_condition": "热身完成",
            "instruction": "完成热身",
            "name": "热身"
          }
        },
        "stop_conditions": [
          "疼痛、胸痛、晕眩或异常呼吸时停止"
        ],
        "technique_notes": [
          "保持动作稳定"
        ]
      },
      "day_3": {
        "activity_kind": "running",
        "duration_minutes": 45,
        "feel_guidance": "按RPE与动作体感执行",
        "load_level": "low",
        "name": "跑步课程",
        "purpose": "维持稳定训练",
        "rpe_max": 4,
        "rpe_min": 2,
        "session_type": "easy_run",
        "steps": {
          "cooldown": {
            "end_condition": "放松完成",
            "instruction": "完成放松",
            "name": "放松"
          },
          "main": {
            "end_condition": "主体完成",
            "instruction": "完成主体",
            "name": "主体"
          },
          "recovery": {
            "end_condition": "恢复完成",
            "instruction": "完成恢复",
            "name": "恢复"
          },
          "warmup": {
            "end_condition": "热身完成",
            "instruction": "完成热身",
            "name": "热身"
          }
        },
        "stop_conditions": [
          "疼痛、胸痛、晕眩或异常呼吸时停止"
        ],
        "technique_notes": [
          "保持动作稳定"
        ]
      },
      "day_4": {
        "activity_kind": "rest",
        "duration_minutes": 0,
        "feel_guidance": "不安排结构化训练",
        "load_level": "low",
        "name": "休息",
        "purpose": "恢复",
        "rpe_max": 1,
        "rpe_min": 1,
        "session_type": "rest",
        "steps": {
          "checklist": {
            "end_condition": "恢复检查完成",
            "instruction": "完成恢复检查",
            "name": "恢复检查"
          }
        },
        "stop_conditions": [
          "出现红旗症状时停止活动"
        ],
        "technique_notes": [
          "无需训练技术要求"
        ]
      },
      "day_5": {
        "activity_kind": "running",
        "duration_minutes": 45,
        "feel_guidance": "按RPE与动作体感执行",
        "load_level": "low",
        "name": "跑步课程",
        "purpose": "维持稳定训练",
        "rpe_max": 4,
        "rpe_min": 2,
        "session_type": "easy_run",
        "steps": {
          "cooldown": {
            "end_condition": "放松完成",
            "instruction": "完成放松",
            "name": "放松"
          },
          "main": {
            "end_condition": "主体完成",
            "instruction": "完成主体",
            "name": "主体"
          },
          "recovery": {
            "end_condition": "恢复完成",
            "instruction": "完成恢复",
            "name": "恢复"
          },
          "warmup": {
            "end_condition": "热身完成",
            "instruction": "完成热身",
            "name": "热身"
          }
        },
        "stop_conditions": [
          "疼痛、胸痛、晕眩或异常呼吸时停止"
        ],
        "technique_notes": [
          "保持动作稳定"
        ]
      },
      "day_6": {
        "activity_kind": "running",
        "duration_minutes": 45,
        "feel_guidance": "按RPE与动作体感执行",
        "load_level": "low",
        "name": "跑步课程",
        "purpose": "维持稳定训练",
        "rpe_max": 4,
        "rpe_min": 2,
        "session_type": "long_easy",
        "steps": {
          "cooldown": {
            "end_condition": "放松完成",
            "instruction": "完成放松",
            "name": "放松"
          },
          "main": {
            "end_condition": "主体完成",
            "instruction": "完成主体",
            "name": "主体"
          },
          "recovery": {
            "end_condition": "恢复完成",
            "instruction": "完成恢复",
            "name": "恢复"
          },
          "warmup": {
            "end_condition": "热身完成",
            "instruction": "完成热身",
            "name": "热身"
          }
        },
        "stop_conditions": [
          "疼痛、胸痛、晕眩或异常呼吸时停止"
        ],
        "technique_notes": [
          "保持动作稳定"
        ]
      },
      "day_7": {
        "activity_kind": "rest",
        "duration_minutes": 0,
        "feel_guidance": "不安排结构化训练",
        "load_level": "low",
        "name": "休息",
        "purpose": "恢复",
        "rpe_max": 1,
        "rpe_min": 1,
        "session_type": "rest",
        "steps": {
          "checklist": {
            "end_condition": "恢复检查完成",
            "instruction": "完成恢复检查",
            "name": "恢复检查"
          }
        },
        "stop_conditions": [
          "出现红旗症状时停止活动"
        ],
        "technique_notes": [
          "无需训练技术要求"
        ]
      }
    },
    "progression_dimension": "none",
    "progression_rule": "hold",
    "schema_version": "training_plan_decision_v1",
    "sos_omission_reason": null,
    "sos_schedule_reason": null
  },
  "uncertainty": [
    "公开合成证据不代表私人判断。"
  ],
  "week_conclusion": "本周完整复盘后，下周保持训练连续性。"
}
